Issue ID,URL,Title,State,Description,Author,Author Username,Assignee,Assignee Username,Confidential,Locked,Due Date,Created At (UTC),Updated At (UTC),Closed At (UTC),Milestone,Weight,Labels,Time Estimate,Time Spent
14,https://costa.ls.fi.upm.es/gitlab/200210/parking-jam/-/issues/14,The system will have different levels and each one will increase the difficulty. Each one will have a different board,Open,"","PÉREZ UPIERRE, SALMA",200210,"","",No,No,,2023-05-10 16:58:41,2023-06-06 20:30:24,,Sprint-2,,"Closed,Feature,Medium",0,0
15,https://costa.ls.fi.upm.es/gitlab/200210/parking-jam/-/issues/15,"The board is divided in squares and will have this items in it: Wall, Red Car, Other vehicles and Parking Exit",Open,"","PÉREZ UPIERRE, SALMA",200210,"","",No,No,,2023-05-10 16:58:57,2023-05-21 01:01:02,,Sprint-1,,"Closed,Feature,High",0,0
16,https://costa.ls.fi.upm.es/gitlab/200210/parking-jam/-/issues/16,Two or more consecuitve wall/vehicle will have the aspect of being only one. Both of them cannot be traversed,Open,"","PÉREZ UPIERRE, SALMA",200210,"","",No,No,,2023-05-10 16:59:07,2023-05-21 00:54:58,,Sprint-1,,"Closed,Feature,High",0,0
18,https://costa.ls.fi.upm.es/gitlab/200210/parking-jam/-/issues/18,All vehicles will move forwards or backwards but not laterally,Open,"","PÉREZ UPIERRE, SALMA",200210,"","",No,No,,2023-05-10 16:59:27,2023-05-21 00:54:03,,Sprint-1,,"Closed,Feature,High",0,0
19,https://costa.ls.fi.upm.es/gitlab/200210/parking-jam/-/issues/19,Design several levels with its respective format. The system will be able to detect if the level is not in the correct format,Open,"","PÉREZ UPIERRE, SALMA",200210,"","",No,No,,2023-05-10 17:00:02,2023-06-06 19:49:38,,Sprint-2,,"Closed,Feature,Medium",0,0
20,https://costa.ls.fi.upm.es/gitlab/200210/parking-jam/-/issues/20,Design the punctuation level. This will be determined by the number of movements,Open,"","PÉREZ UPIERRE, SALMA",200210,"","",No,No,,2023-05-10 17:00:22,2023-06-06 19:49:38,,Sprint-2,,"Closed,Feature,Medium",0,0
22,https://costa.ls.fi.upm.es/gitlab/200210/parking-jam/-/issues/22,The app will display a HUD around the board that will provide some information to the user.,Open,"","PÉREZ UPIERRE, SALMA",200210,"","",No,No,,2023-05-10 17:00:53,2023-06-06 19:49:38,,Sprint-2,,"Closed,Feature,Low",0,0
25,https://costa.ls.fi.upm.es/gitlab/200210/parking-jam/-/issues/25,The application will have a game menu,Open,"","PÉREZ UPIERRE, SALMA",200210,"","",No,No,,2023-05-10 17:01:30,2023-06-06 19:49:38,,Sprint-2,,"Closed,Feature,High",0,0
